{
  "schema_version": "ISRAS-ESIA-V1",
  "assessment_id": "esia-example-v2",
  "status": "DRAFT",
  "repository": "Iron-Signal-Systems/example-repository",
  "assessment_date": "2026-01-01",
  "current_baseline": {
    "version": "1.0.1",
    "signed_release_tag": "isras-v1.0.1",
    "commit": "0000000000000000000000000000000000000000",
    "source_manifest_sha256": "0000000000000000000000000000000000000000000000000000000000000000"
  },
  "candidate_release": {
    "version": "2.0.0",
    "signed_release_tag": "isras-v2.0.0",
    "commit": "0000000000000000000000000000000000000000",
    "source_manifest_sha256": "0000000000000000000000000000000000000000000000000000000000000000",
    "accepted": false
  },
  "trigger": "CANDIDATE_PLANNING",
  "phase_context": {
    "phase": "Example Phase",
    "in_progress": false,
    "entry_baseline_locked": true
  },
  "controls": [
    {
      "control_id": "ISRAS-GOV-004",
      "classification": "REQUIRES_DOCUMENTATION",
      "justification": "Example classification to be replaced by the adopting repository.",
      "affected_artifacts": [
        "docs/engineering/isras-governance.md"
      ],
      "owner": "repository-owner",
      "target_phase_or_milestone": "Before v2 adoption",
      "validation_impact": "Add compliance validation.",
      "acceptance_impact": "Update acceptance criteria.",
      "exception_or_deferment": null
    }
  ],
  "decision": "ADOPT_NEXT_PHASE",
  "decision_justification": "Draft planning decision pending accepted v2 release and repository review.",
  "reviewer": "pending-reviewer",
  "approval": {
    "decision": "PENDING",
    "approver": "pending-approver",
    "date": null
  },
  "completed_at": null
}
